id,type,text1,text2,text3,notes
tahlan_lace,WEAPON,"In need of a high-output energy weapon, but discontent with the heavy flux profile of blaster-type weapons, ScalarTech instead opted for a design using alternating pulsers to achieve high output through rate of fire alone.",,,
tahlan_lacette,WEAPON,"The little sister of the Lace, the Lacette is a downscaled variant that achieves the same rates of fire as the larger model, but sacrifices individual shot performance.",,,
tahlan_string,WEAPON,A small diffuse particle pulse gun designed for point defense. Quite effective as long as the capacitors last.,,,
tahlan_tousle,WEAPON,"Adapting the design principle of the Sabot SRM to a gun platform, the Tousle fires a splitting warhead that can effectively suppress shields.",,,
tahlan_stitch,WEAPON,An array of supercharged ion beam emitters. Capable of dealing considerable damage in addition to the disabling effects of conventional ion weaponry.,,,
tahlan_stitchette,WEAPON,A pair of supercharged ion beam emitters. Capable of dealing considerable damage in addition to the disabling effects of conventional ion weaponry.,,,
tahlan_ocbeam,WEAPON,"The massive weapon at the core of the Midi-class cruiser weaponizes the ship's flux for a highly destructive directed energy beam. While it requires a considerable amount of flux to have accumulated to be able to fire, it only generates little flux of itself and can easily deal crippling damage to a target.",,,
tahlan_baste,WEAPON,"An unusual multirole weapon firing diffuse ion pulses that explode violently when their containment field is disrupted. As this blast effect allows them to function similar to flak weaponry, the gun was fitted with a rudimentary PD targeting system.",,,
tahlan_sew,WEAPON,"With the Ruffle having become a mainstay in the ScalarTech arsenal, it was only a matter of time till a smaller variant of the gun was conceived. While it lacks the sheer output of its much bigger sister, the Sew still shares many of its good attributes.",,,
tahlan_spiral,WEAPON,"The Spiral is a lightweight torpedo originally designed for the Skirt-class frigate to give them small vessel more punch against larger targets. While not especially devastating, an integrated missile autoforge allows for virtually limitless ammunition.",,,
tahlan_spiral2_l,WEAPON,"A retrofitted variant of the Spiral torpedo, adapted specifically for the needs of the Sateen. Due to the off-center mounting of the weapon, it was upgraded with a guidance package at the cost of top speed.",,,
tahlan_spiral2_r,WEAPON,"A retrofitted variant of the Spiral torpedo, adapted specifically for the needs of the Sateen. Due to the off-center mounting of the weapon, it was upgraded with a guidance package at the cost of top speed.",,,
tahlan_seam,WEAPON,"An odd weapon design that came about more by accident than intent, the Seam fires a large salvo of unstable ion blasts similar to other ion weaponry, but a not fully understood fault in the weapon's emitters causes a small number of these projectiles to catastrophically destabilize on impact, causing devastating damage. While it is unclear why this happens, the effect is certainly of benefit to the weapon's combat effectiveness.",,,
tahlan_crinkle,WEAPON,"The result of attempting to put as heavy an ion weapon as possible into a small weapon mount, this weapon is exceedingly devastating to the systems of ships of all sizes and only held back by requiring a replacement of its discharge coils after too many uses.",,,
tahlan_tear_small,WEAPON,"Carrying a large hyperpulse blast core with proximity fuze, the Tear is an exceptional strike weapon, capable of crippling even large ships.",,,
tahlan_tear_medium,WEAPON,"Carrying a large hyperpulse blast core with proximity fuze, the Tear is an exceptional strike weapon, capable of crippling even large ships. The Starlight launcher system is capable of carrying additional ammunition.",,,
tahlan_tear_lrg,WEAPON,"Carrying a large hyperpulse blast core with proximity fuze, the Tear is an exceptional strike weapon, capable of crippling even large ships. While the relatively limited range of the torpedo often makes it less ideal to field on capital ships, the Hyperlight launcher's vast ammo storage can make up for this shortcoming.",,,
tahlan_fold,WEAPON,"Unique to the Skirt-class frigate, the Fold is an integrated variant of the Crinkle-type Disruptor. While individual shot power has been halved compared to the regular variant of the weapon, the Fold can be fired more rapidly and recharge its capacitors mid-combat from the Skirt's main reactor.",,,
tahlan_pin,WEAPON,A lightweight swarmer missile for use against fightercraft. Highly reliable due to excellent flight characteristics and a proximity-fused warhead.,,,
tahlan_magmine,WEAPON,A standard magpulse bomb as used by STS bombers.,,,
tahlan_strass,WEAPON,"The Strass is a low-energy blaster variant that was trimmed for efficiency. While its overall output falls below even pulse laser weaponry, it can still boast decent armor penetration characteristics at a low overhead.",,,
tahlan_strassette,WEAPON,"The Strassette is a low-energy blaster variant that was trimmed for efficiency. While its overall output falls below even pulse laser weaponry, it can still boast decent armor penetration for its size at a low overhead.",,,
tahlan_banshee_pd,WEAPON,A small diffuse particle pulse gun designed for point defense. Quite effective as long as the capacitors last. ,,,
tahlan_tineola,WEAPON,"Housed in a truly massive missile, the Tineola's Distortion warhead is the perhaps most destructive device ever cooked up by ScalarTech's engineers. Capable of ripping apart anything caught in its massive blast, this guided torpedo rivals even the notorious Reaper.

Distortion warheads are a terrifying piece of technology indeed, but are heavier than most alternatives and require a significant amount of energy to arm on launch, putting some strain on the firing vessel's flux grid. The result is a large and lumbering torpedo that struggles to catch faster targets without, but can weather a surprising amount of damage from point-defense weapons.

The exact reason for the development of this devastating weapons is subject of frequent debate in certain circles with a leading theory being its use as a planetary bombardment weapon to be deployed as a deterrent. While it has never been deployed in such a manner, the sheer yield of the weapon and its heavy plating, easily capable of surviving planetary reentry, have given the theory a fair bit of credibility.",,,
,,,,,
#Ship Systems,,,,,
tahlan_cycleaccel,SHIP_SYSTEM,Briefly triples cycle rate of energy weapons and reduces flux generation accordingly. Does not affect beam dps.,Weapons,,
tahlan_capoverdrive,SHIP_SYSTEM,Doubles energy weapon damage for 1.5s. Holds 3 charges.,Weapons,,
tahlan_secondwave,SHIP_SYSTEM,Deploys additional fighters that can fight for a short time before returning to the carrier. Can temporarily raise the number of deployed fighters above the maximum wing size. All fighters gain increased speed for a short while after system activation.,Fighters,,
tahlan_chainskimmer,SHIP_SYSTEM,"Teleports a very short distance. Less range than a phase skimmer, but can be chained in rapid succession.",Mobility,,
tahlan_supercruise,SHIP_SYSTEM,"Switches all systems to supercruise mode, diverting power to the drive systems. Accelerates forward, increasing top speed by 50 and improving maneuverability, but reduces weapon ranges and flux dissipation by 1/3.",Mobility,,
tahlan_swarmerstrike,SHIP_SYSTEM,Teleports in two squadrons of swarmers near the target to distract both point defense and hostile fighters.,Fighters,,
tahlan_magminestrike,SHIP_SYSTEM,Teleports a cluster of 5 emp mines to the target location.,Assault,,
tahlan_limitrelease,SHIP_SYSTEM,"Boosts energy weapon rate of fire, top speed and dissipation for 6 seconds, but reduces them for 3.5 seconds afterwards. Allows some dissipation of hard flux with deployed shields during boost period.",Assault,,
tahlan_powersurge,SHIP_SYSTEM,"Boosts energy weapon rate of fire, top speed and dissipation for 2.5 seconds, but reduces them for 1 seconds afterwards. Allows some dissipation of hard flux with deployed shields during boost period. Can hold 3 charges.",Assault,,
tahlan_pulsedrive,SHIP_SYSTEM,Swiftly boost forward. Can hold multiple charges.,Mobility,,
tahlan_overboost,SHIP_SYSTEM,"Supercharges drive systems, greatly boosting speed and discharging emp arcs at nearby targets.",Mobility,,
tahlan_berserk,SHIP_SYSTEM,"Switches all systems to berserk assault mode. Reduces damage taken by 2/3, increases top speed and boosts energy and ballistic weapon damage. Disables shields while active, reduces weapon ranges and high system stress results in a short overload upon system shutdown.",Mobility,,
tahlan_emsuppression,SHIP_SYSTEM,"Suppresses the target's point defense systems with false signatures, reducing the effective range of all PD weapons and damage done to missiles and fighters by 25%.",Suppression,,
tahlan_flickerdrive,SHIP_SYSTEM,"Briefly become intangible, dissipating some flux and boosting mobility. Discharges EMP bolts on nearby targets and projectiles upon activation. Holds up to 3 charges.",Mobility,,
tahlan_loaderjets,SHIP_SYSTEM,Provides a modest boost to speed and maneuverability.,Mobility,,
tahlan_emprelay,SHIP_SYSTEM,Discharges EMP arcs from fighters at targets near them. Generates flux on use.,Fighters,,
tahlan_coildischarge,SHIP_SYSTEM,"Discharges residual energy in phase coils as EMP arcs. Fires one bolt per phase coil, dealing 100 energy and emp damage, which is doubled during phase coil cooldown. Generates 400 flux on use.",,,
,,,,,
#Campaign,,,,,
tahlan_planet_jacquard,CUSTOM,"Having caught the remains of a planetary collision many millenia ago, Jacquard has formed an unusual ring of what could best be described as floating continents at the upper edge of its atmosphere. Rich in ores, they now supply the industries of ScalarTech and even house numerous industrial centers on their surfaces themselves.",,"Your pilot curses as your ship navigates the field of planetary fragments, not keen on colliding with an asteroid your drive bubble might not be able to deflect. A sigh of relief goes through the bridge crew as the floating continent hosting Jacquard's main starport comes into view, set against the vast golden surface of the gas giant.",
tahlan_planet_charkha,CUSTOM,"The jewel of the Spindle system, Charkha was once an almost terran garden world. While still inhabitable, the planet has been forever scarred by the catastrophic effects of the failed gateway experiment, massive tracts of land rendered infertile and the atmosphere irradiated.",,"Glimmering lights illuminate the bridge on your approach, the unpredictable radiation fields around the planet shifting constantly before your eyes. Whenever you pass through one of the shimmering bands that envelop Charkha, you feel a tingle on your neck, even though your ship's shielding should prevent any radiation from coming through. ",
tahlan_planet_mika,CUSTOM,"Home to only a minor number of defensive facilities, Charkha's moon is effectively uninhabited, though a popular lullaby has it that a colony of lunar cats live there, watching over the children of Charkha in the dark of the night.",,,
tahlan_planet_ardor,CUSTOM,"Once an independent mining colony, Ardor fell into lawlessness during the events following the Collapse. While the STDF would like to just eradicate the pirate presence, it has repeatedly been deemed not worth the effort as STDF patrols have proven more than capable of keeping raiders at bay.",,,
,,,,,
scalartech,FACTION,"Originally a smaller corporation that specialized in advanced transport and drive technologies, it was only a few years prior to the Collapse that ScalarTech Solutions branched out into the military sector. With a promising line of new military vessels in development and the first few models in production having found good success with some planetry defense forces in other sectors, prospects for the young corporation were good. Like for any other corporation in the sector, the Collapse changed this all too drastically.

Cut off from the rest of Domain space and anticipating the chaos that was likely to follow, the corporation ramped up production of its new line of warships and established the ScalarTech Defense Force while at the same time forming an agreement with the planetary government of Charkha to act as the Spindle system's defensive force. While ultimately no more than a larger system defense force, the STDF's military might proved more than sufficient to dissuade opportunistic raiders from attacks on the system and guaranteed a semblence of stability. As the years passed without any signs of the gates reactivating, ScalarTech was transformed into state corporation, taking over government functions within the Spindle system, the role of CEO now an elected position. Now known as the Spindle Protectorate it has largely shed its corporate origins over the following decades.

Adopting a position of neutrality after the arrival of the XIVth Battlegroup and the subsequent troubles while agreeing to at least superficially follow old Domain regulations, Spindle has managed to maintain generally positive relations with most powers in the sector, even if only because military action against the by now heavily fortified Spindle system wouldn't be worth the effort.",,,
,,,,,