id,type,text1,text2,text3,notes
#Ships,,,,,
tahlan_filament,SHIP,"Representing a wholly unique approach to carrier design, the Filament-class Bridgehead Battlecarrier was the first ship class to carry a Renham-Bergenson-Device. Capable of maintaining a stable wormhole connection with an STDF Blacksite equipped for fighter operations, it acts as the de-facto hangar facility of the ship. While the device is large in size, it ultimately occupies far less space than normal fighter bays would and the larger facility it is linked to facilitates superior fighter maintenance. The saved space has been used to equip the ship with heavy armaments and powerful shielding, making it capable of going toe-to-toe with battleships in direct combat.

At the time of its inception, the idea of using a ship-scale Renham-Bergenson-Device instead of hangars was regarded as the keystone for ScalarTech Solutions to break into the market for Domain military contracts. Complex as the design is, its advantages can't be denied. With extensive trials having proven the stability of the wormhole connection under combat conditions, the Filament was going to be the poster child for the ScalarTech MilTec Division, offering a combat carrier with fighting power close to a normal battleship without sacrificing fighter capacity. Sadly the ship design was still undergoing trials with a number of Domain Battlegroups at the time of the Collapse, making it now impossible to know whether the ship would've lived up to expectations.

With the massive military buildup of the STDF in the early years of the Collapse, the Filament proved itself as the backbone of their fleets with its flexible mission profile and top-of-the line specs. While the Gown-class Battlestars have become truly famed as the defenders of Spindle, it is in fact the ever-reliable Filaments and their task forces that will swiftly react to any threat and deal with it, a service that is well-recognized within the STDF with Filament captains shown the same respect as those who command the mighty Gowns.",,,
tahlan_strand,SHIP,"Developed from the Filament, the Strand-class carrier sacrifices the former's direct combat potential to become a dedicated carrier, having been trimmed down to the minimum essentials necessary to operate a Renham-Bergenson-Device. Smaller in scale and logistical profile, what remains is an exceedingly efficient dedicated carrier.

With the Filament's great success as the backbone of STDF fleets, it proved only logical to create a more specialized carrier based on the now proven Renham-Bergenson-Device. Initial trials of the Strand in c+23 were promising and by c+26 it had entered full production. Initial worries that the automated constructor ships building the necessary blacksites within the asteroid belt might not be able to keep up with the increased demand, turned out to be wrong and soon the STDF had majorly improved its ability to bring fighter support wherever needed.

Since its full introduction, the Strand has become a common sight in STDF fleets, with many smaller tast forces built around one of these vessels. They may lack the prestige of the Filament, but they are nonetheless powerful workhorses and excellent command ships with their sophisticated sensor suite.",,,
tahlan_brim,SHIP,"Introduced by ScalarTech as a modern alternative to the Hammerhead, the Brim is an offensively-oriented destroyer. Capable of employing its high speed and Cycle Accelerator system in powerful hit-and-run attacks, it can take on larger opponents effectively and run down retreating vessels.

The Brim was one of the first military hull designs proposed by the freshly formed MilTec branch of ScalarTech Solutions. A fairly straightforward design with its heavy assault focus, the ship took advantage of ScalarTech's state-of-the-art power capacitor technology to enable its massive bursts of firepower. Having gone into full production before the Collapse, it brought in plenty of orders from planetary governments and was on the way to becoming a staple in PDFs across the galactic region.

Post-collapse the ship continued its distinctive service in the STDF as one of the most numerously deployed vessels. Reliable and armed with a lot of bite, the Brim is an excellent stepping stone for the careers of young officers.",,,
tahlan_hem,SHIP,"A hyperaggressive attack frigate with a purely offensive weapon layout. Sacrificing any effective point-defense capability, it relies heavily on its efficient shields and the high mobility granted by its fast-cycling Chain Skimmer for survival.",,,
tahlan_verge,SHIP,"An aggressive cruiser designed on the idea of upscaling the Brim. Heavily armed and outfitted with a Cycle Accelerator system, the ship has devastating firepower.",,,
tahlan_gown,SHIP,"The largest vessel ever constructed in the ScalarTech shipyards and the crown jewel of the STDF, the Gown-class Battlestar incorporates all the best technologies available to ScalarTech Solutions at the time of its construction. Lightweight for a ship of its scale, it relies on heavy shielding for defense and is armed with a terrifying array of weapon mounts, making it a potent combatant in of itself. Supplementing these capabilities is the largest functional Renham-Bergenson-Device ever constructed, allowing the Gown to maintain passage for multiple fighter wings operating via an STDF Blacksite.

ScalarTech Solutions allegedly first drafted the plans for the Gown around c-15, intended as a prestige project and to establish the relatively young corporation as a top contender for Domain military contracts. While the events of the Collapse led to multiple delays in the construction, a number of Gown-class Battlestars still saw completion in the early years after the collapse, quickly pushed into service as flagships of the quickly expanding number of STDF fleets as part of ScalarTech's efforts to secure their position in the Spindle system.

Having stood as a bulwark against hostile incursions into the Spindle system, the Gowns have become a symbol of the STDF's guardianship. Most notably the SDS Shield of Providence has become a permanent fixture in the night sky of Charkha, permanently stationed in the planet's orbit in a solemn vigil. The sheer reverence for these massive vessels can not be understated and the loss of one would strike a great blow to the population of Spindle's worlds.",,,
tahlan_margin,SHIP,"In essence a downscaled version of the Brim, the Margin-class attack frigate is an agile gunship with deceptively high firepower. Easily the most common ship in the STDF fleet, it is reliable and effective in most frigate roles.

The Margin is one of the few designs developed specifically due to customer demand. With the Brim's great success in various PDFs, many requests for a smaller-scale variant were made to supplement small patrol forces. While the Margin never reached mass-production readiness before the Collapse, the STDF saw great potential in the frigate and began deploying them in large number once it entered full production.",,,
tahlan_frill,SHIP,"The Frill is a robust destroyer with good armament and even better shields. Designed to be sturdy and hold the line in battle, it is also capable of pressing an advantage.",,,
tahlan_skye,SHIP,"One of the newest ship designs in the ScalarTech Fleet Roster, the Skye is an agile attack cruiser. To give it an edge in combat, the ship was equipped with an enhanced power core. While only capable of operating at full capacity for short periods of time without causing damage to the power grid, the massive performance spikes allow the Skye to quickly turn the tide in combat.

Introduces well after the Collapse, it is believed the design of the Skye was at least partially influenced by technological exchange with other factions in the sector. The ship made an immediate impact upon its introduction to the STDF fleet, enabling more aggressive tactics and being crucial to success in a number of strikes against pirate bases in the vicinity of Spindle. Despite this, the Skye remains one of the rarer ships within the fleet due to its late introduction and expensive manufacture.",,,
tahlan_skye_hana,SHIP,"A variant design of the standard model Skye-class, this ship was the test platform for an improved version of the limit release system. More flexible than the standard system, this alternate version is quite effective, but was deemed an insufficient improvement to outweigh the vastly increased complexity of the system structure. This particular example of this short line of test hulls was also further upgraded with a pair of Spiral torpedo tubes, likely salvaged from a destroyed Skirt-class frigate.

One of the newest ship designs in the ScalarTech Fleet Roster, the Skye is an agile attack cruiser. To give it an edge in combat, the ship was equipped with an enhanced power core. While only capable of operating at full capacity for short periods of time without causing damage to the power grid, the massive performance spikes allow the Skye to quickly turn the tide in combat.

Introduces well after the Collapse, it is believed the design of the Skye was at least partially influenced by technological exchange with other factions in the sector. The ship made an immediate impact upon its introduction to the STDF fleet, enabling more aggressive tactics and being crucial to success in a number of strikes against pirate bases in the vicinity of Spindle. Despite this, the Skye remains one of the rarer ships within the fleet due to its late introduction and expensive manufacture.",,,
tahlan_tress,SHIP,"The result of further attempts to downscale the Bridgehead carrier design is an effective light carrier. While the shortened Renham-Bergenson-Device is still fully functional, the half-ring configuration doesn't allow for the performance spikes a proper ring configuration is capable of. To compensate, engineers managed to maintain the potent missile armament capabilities of the Strand even on this smaller hull, giving it a surprising punch for a light carrier.

Often referred to as the ""Sawn-off Strand"" and other such monikers, the Tress isn't looked too kindly upon by most and written off as a silly idea. Notorious for the relative instability of its RBD due to the reduced ring area and its weird appearance, the class's service record tells a much more impressive story, reporting excellent operational reliability.",,,
tahlan_curl,SHIP,"Given the aggressive nature of other ScalarTech-designed frigates, the Curl was introduced to shore up their defensive shortcomings. Equipped with superior shields and a pulse drive system to keep it at the frontline of combat, it can draw fire for its allies.

Curl captains are said to be a crazy lot, as one would expect of anyone in command of a ship that is designed to charge into battle with reckless abandon. For many it is the stepping stone towards command of a Frill-class destroyer, often regarded as the Curl's big sister.",,,
tahlan_vestige,SHIP,"What is now known as the Vestige was originally a competing design in the ship development project that ultimately resulted in the Verge-class. Heavier than its counterpart, this design incorporated a number of experimental technologies. Upsized heavy weapon capacitor banks give it the capability to operate all mounted weaponry at above spec performance levels, allowing it to mount fewer, more powerful weapons as a result. The standout feature of the design, however, is the performance limiter override system, commonly nicknamed ""Berserk Mode"", a predecessor to the Limit Release system that would later find use in the Skye-class cruisers. Lacking the refinements of the later version, the Berserk system pushes the ship's performance well past all safety limits, turning it into a nigh-unstoppable force of corruption, but the absence of the emergency shutdown systems found on the Skye results in catastrophic system overload upon system shutdown.

The vestige prototypes proved extremely effective, but the design was ultimately rejected due to excessive production requirements and concerns by top staff that the Berserk system could lead to unnecessary losses of ships and crews. The few built prototypes were mothballed and put in storage for years to come, but were reactivated on a few occasions when STDF tacticians had a need for the particular capabilities of the ship class, each time performing to expectations and repeatedly raising the question whether to put the design into action. In the end incorporation of some of the Vestige's design elements into the new Skye-class finally put these considerations to rest.",,,
tahlan_skirt,SHIP,"A high-performance attack frigate that relies on its high mobility for defense. Armed with a pair of highly potent EMP blasters, it excels at flanking and striking vulnerable targets. While otherwise seemingly undergunned, it is outfitted with a unique dual capacitor bank system that allows it to fire equipped energy weapons at doubled rates.

The youngest design in ScalarTech's fleet catalogue, the Skirt was only introduced after the First AI War. The ship employs a number of technologies that were still regarded as experimental at the time but ship trials provided sufficient confident and allowed the ship to go into full, albeit limited, production. With its high specs but lack of dedicated defensive systems, only the best frigate commanders are put in command of one of these ships, keeping their numbers limited.",,,
tahlan_midi,SHIP,"The textbook definition of a weapon with engines, the Midi was designed and built around her powerful Overcharge Beam weapon. With only limited defensive capabilities, it excels in a fire support role, bringing to bear a stunning amount of firepower between its primary weapon and mine teleporter system.",,,
tahlan_camise,SHIP,"Fast, well-shielded and capable of defending itself, the Camise is a large military-grade freighter and ScalarTech Solution's in-house alternative to the commonly used Atlas. While the ship sacrifices logistical capacity in comparison, its toughness has proven invaluable in the post-Collapse environment, requiring only light escorts to withstand pirate attacks.

Once the backbone of ScalarTech's at the time primarily civilian fleet, the Camise helped build the corporation into the logistics powerhouse that allowed it to break into the military sector. The ship's original design was in fact much closer to the Atlas, using the same universal container modules and less heavily defended. The Collapse in particular sparked a number of upgrades to the design, including the larger and better armored container units it now carries and the heavy military-grade shield emitters.",,,
tahlan_camisette,SHIP,"Offering more cargo capacity than the common Buffalo at an acceptable increase in operational cost, the Camisette is a capable freighter employed all over the Spindle Protectorate.

Essentially a shortened variant of the Camise-class freighter, the Camisette is a post-Collapse development, originally designed to cover in-system shipments between Charkha and Jacquard. Unrevolutionary in its design, it has served the protectorate well and found some favour with free traders looking for an alternative to the ever-present Buffalo.",,,
tahlan_culotte,SHIP,"A large tanker based on the Camise-class spaceframe, the Culotte shares the former's heavy military-grade shielding and excellent speed, resulting in a highly capable hull. ",,,
tahlan_corset,SHIP,"Fast and aggressive, the Corset-class battlecruiser is a blunt but effective tool in the ScalarTech arsenal. With a heavy battery of forward-firing weaponry, it is capable of laying down staggering firepower, but relies on support to protect its more vulnerable flanks and is naturally at home at the center of a battleline.",,,
tahlan_sateen,SHIP,"The Sateen represents the latest development in ScalarTech ship design and is the first ship to be outfitted with a reality displacement shell, commonly named the Flicker Drive. Tuned for aggression, the hull sacrifices survivability for mobility, equipped with a by ScalarTech standards undersized shield generator to free up the capacity for a total of five Mark 9 STS Drive Units while still mounting a potent weapons suite.

The general concept behind the Sateen had been proposed on multiple occasions throughout the past few decades within ScalarTech's design bureau, but only found much reception once the Skye-class cruiser had proven the concept of an agile strike ship. This coincided with the first successful trial runs of initial Flicker Drive prototypes and it was decided to incorporate this new technology in the new project. Overall, the Sateen is a major departure from prior doctrine for capital-class vessels which to that point had invested heavily into their staying power, but the new battlecruiser would sacrifice the usual defensive capabilities to achieve its design goals of high mobility and offensive power. The earlier design variants were truly glass cannons in every sense of the word, but a new breakthrough in nano-polymer armor technology would eventually help shore up this weakness to a degree by providing the ship with an armored shell capable of backing up the weak shields. While still hardly a sturdy ship, this new armor package would ultimately give the Sateen the necessary combat viability needed to be put into actual production.

With the design still being new, few Sateens have entered service with the STDF at this time, but initial combat performance records are promising and a considerable number of veteran STDF commanders have applied for command on one of the still under construction vessels, hoping to distinguish themselves by helping write the book on operation of the new hull.",,,
tahlan_sateen_kim,SHIP,"A variant design of the baseline Sateen, the Kimono replaces all medium mounts with a significant number of small mounts to achieve superior volume of fire. The ship has also been outfitted with an advanced targeting core to offset the lower base range of small weaponry.

The Sateen represents the latest development in ScalarTech ship design and is the first ship to be outfitted with a reality displacement shell, commonly named the Flicker Drive. Tuned for aggression, the hull sacrifices survivability for mobility, equipped with a by ScalarTech standards undersized shield generator to free up the capacity for a total of five Mark 9 STS Drive Units while still mounting a potent weapons suite.

The general concept behind the Sateen had been proposed on multiple occasions throughout the past few decades within ScalarTech's design bureau, but only found much reception once the Skye-class cruiser had proven the concept of an agile strike ship. This coincided with the first successful trial runs of initial Flicker Drive prototypes and it was decided to incorporate this new technology in the new project. Overall, the Sateen is a major departure from prior doctrine for capital-class vessels which to that point had invested heavily into their staying power, but the new battlecruiser would sacrifice the usual defensive capabilities to achieve its design goals of high mobility and offensive power. The earlier design variants were truly glass cannons in every sense of the word, but a new breakthrough in nano-polymer armor technology would eventually help shore up this weakness to a degree by providing the ship with an armored shell capable of backing up the weak shields. While still hardly a sturdy ship, this new armor package would ultimately give the Sateen the necessary combat viability needed to be put into actual production.

With the design still being new, few Sateens have entered service with the STDF at this time, but initial combat performance records are promising and a considerable number of veteran STDF commanders have applied for command on one of the still under construction vessels, hoping to distinguish themselves by helping write the book on operation of the new hull.",,,
tahlan_belt,SHIP,"The Belt was a very early combat design of ScalarTech's design bureaus, adapted from a heavy industrial mover. While initially never intended for mass production, the ship eventually still found widespread use within STDF fleets thanks to its low production costs and adequate combat performance.

",,,
tahlan_percale,SHIP,"While STDF doctrine does not make extensive use of phase ships, the ScalarTech Engineering Division saw the need to remain on top of this particular technology branch. The Percale-project served as the testbed for a variant phase coil design operating at different p-space frequencies than those designed by the tri-tachyon corporation. What actual benefits this has is not currently known, but it is generally unclear whether this is due to ScalarTech keeping it a secret or the simple lack of such benefits. The Percale herself is a potent strike cruiser capable of delivering devastating blows in a moment's notice while possessing excellent tactical flexibility.",,,
tahlan_twine,SHIP,An agile interceptor heavily specialised in taking on enemy fightercraft in dogfight combat. Armed with a set of swarm missiles to catch even the most evasive targets.,,,
tahlan_dessous,SHIP,"A bit of a prestige project of the STS fightercraft design bureau, the provocatively named Dessous is a large fighter with heavy armamant and extended operational range. Robustly built and well-shielded, it is capable of striking vulnerable targets even inside some enemy fleet formations.",,,
tahlan_angora,SHIP,"An agile phase destroyer as employed by the Spindle Protectorate, the Angora is one of the newest ships in the faction's roster. Designed to aggressively dive in and out of phased space, the ship shines when it can put its coil discharge system to frequent use.

Technically developed before the Percale, the Angora was actually introduced into active service later, having initially been the testbed for the Percale's phase coils. With the larger ship seeing some success, the Angora's blueprints were put back on the drawing board and overhauled with the service experience of the Percale in mind, pushing the design into a state more suited for mass production.",,,
tahlan_silken_banshee,SHIP,"Carrying heavy missile armament and decently agile, this Battlecruiser is only held back by its relative fragility and the fact that only one was ever built.

Originally constructed based on licensed blueprints as an early testbed for the MilTec subdivision of ScalarTech Solutions, the Silken Banshee is a decently capable battlecruiser with a striking silhouette. While it carries a high efficiency shield and more armor than other ScalarTech ships, the low shield coverage and fragile structure leave the ship vulnerable to flanking attacks.",,,
tahlan_frock,SHIP,"The definitive missile platform produced by ScalarTech Solutions is a decently agile cruiser with a flexible missile armament. While design concerns limited its ability to use unguided munitions due to mount placement, this was the price it had to pay for being outfitted with an autoforge to keep its armaments fed even in long engagements.

The Frock's design goes back to the experimental Silken Banshee, but reduced to a more sensible scale for mass production. Originally developed shortly after the collapse, the class didn't see actual production till c142 as its capabilities were deemed less important than what ScalarTech's more conventional designs offered.",,,
,,,,,
#Fighters,,,,,
tahlan_thread,SHIP,"The Thread-class swarmer is a small and agile figher armed with a single high-velocity diffuse pulse laser that can pose a notable threat to most other fighter craft. While unsuitable for engaging larger targets by itself, it can effectively screen for bombers and distract enemy point-defense systems.",,,
tahlan_fiber,SHIP,"Built for the sole purpose of bringing a maximum amount of devastation to hostile ships, the Fiber is a heavy bomber carrying a single Type-13 Magnetic Hyperpulse Bomb, short ""Magbomb"", with exceedingly high destructive potential. Featuring a large blast radius and dual timed proximity and impact fuses, this inertia-launched bomb is capable of taking out most kinds of targets and crippling any which might survive an initial strike.",,,
tahlan_cord,SHIP,"Effectively a Lacette with a fighter chassis constructed around it, the Cord is an excellent generalist fighter with plenty of bite.",,,
tahlan_plaid,SHIP,A defensive drone designed to compensate for the Skirt's lack of point defense weaponry.,,,
tahlan_stocking,SHIP,"Mounting a single Crinkle with single-use replacable capacitor, the Stocking is a versatile strike bomber that can deliver a reliable punch to even agile targets.",,,
tahlan_garter,SHIP,It is said that aerospace engineers will attempt to mount any decent missile or torpedo on a fighter sooner or later. This saying proved true for the Tear-class torpedo and as such the Garter was born.,,,
,,,,,
#Weapons,,,,,
tahlan_ruffle,WEAPON,"Modern as it looks, the technical design of the Ruffle is actually quite antiquated, firing a bolt of heavily energized particles that are high in destructive power, but relatively ineffective against modern starship defenses. ScalarTech engineers have simply used modern high-end capacitor technology to amplify the weapon's raw output to a point it can deliver solid damage to these defenses and is utterly devastating to unprotected hull.

The Ruffle was a post-Collapse project prompted by the corporations initial lack of production chips for plasma cannons. Looking for a replacement option, STS engineers eventually decided to simply scale up the String-type particle pulse gun and use their state of the art capacitor tech to amp up the particle energy levels. The resulting design is rather crude, but shows that sometimes raw power can be enough to make something work.",,,
